{
  "specVersion": 1,
  "source": "custom",
  "name": "Minimal example: an airless rock",
  "seed": 1,
  "star": {
    "temperatureK": 5772,
    "luminositySolar": 1,
    "radiusSolar": 1
  },
  "orbit": {
    "distanceAU": 0.39,
    "periodYears": 0.24
  },
  "body": {
    "radiusEarth": 0.38,
    "massEarth": 0.055,
    "gravityG": 0.38,
    "rotationHours": 1407.6,
    "tidallyLocked": false,
    "axialTiltDeg": 0.03
  },
  "air": {
    "pressureBar": 0,
    "gases": {},
    "cloudCover": 0
  },
  "surface": {
    "cells": [
      [0.0, 0.525731, 0.850651, 1.2, 368.5, 0, 0],
      [0.525731, 0.850651, 0.0, -0.8, 110.0, 0, 2],
      [0.850651, 0.0, 0.525731, 0.4, 400.0, 0, 0],
      [0.0, 0.525731, -0.850651, 2.1, 368.5, 0, 0],
      [0.525731, -0.850651, 0.0, -1.5, 110.0, 0, 2],
      [0.850651, 0.0, -0.525731, 0.0, 400.0, 0, 0],
      [0.0, -0.525731, 0.850651, 0.9, 368.5, 0, 0],
      [-0.525731, 0.850651, 0.0, -0.3, 110.0, 0, 2],
      [-0.850651, 0.0, 0.525731, 1.7, 400.0, 0, 0],
      [0.0, -0.525731, -0.850651, -2.2, 368.5, 0, 0],
      [-0.525731, -0.850651, 0.0, 0.6, 110.0, 0, 2],
      [-0.850651, 0.0, -0.525731, -0.9, 400.0, 0, 0]
    ],
    "seaLevelKm": -10,
    "freezingK": 273.15,
    "boilingK": 273.16,
    "steam": false
  }
}
